,title,content
0,吉林市科学技术局关于印发《2021年吉林市碳纤维及复合材料产业科技创新专项计划指南》的通知,吉林市科学技术局关于印发《2021年吉林市碳纤维及复合材料产业科技创新专项计划指南》的通知吉林市科学技术局关于印发《2021年吉林市碳纤维及复合材料产业科技创新专项计划指南》的通知（吉市科技发〔2021〕9号）各有关单位：现将《2021年吉林市碳纤维及复合材料产业科技创新专项计划指南》印发给你们，请按照要求做好项目申报工作。特此通知。附件：2021年吉林市碳纤维及复合材料产业科技创新专项计划指南2021年3月30日附件2021年吉林市碳纤维及复合材料产业科技创新专项计划指南吉林市科学技术局2021年3月目录（一）战略研究软科学专项（二）中国（吉林化纤杯）碳纤维复合材料设计与应用创新创业大赛（三）碳纤维及复合材料产业科技创新专项（四）碳纤维产业链发展支撑2021年吉林市碳纤维及复合材料产业科技创新专项计划指南为推进我市碳纤维产业链与创新链深度融合，做大做强我市碳纤维及复合材料产业，围绕吉林市建设国际碳纤维及复合材料产业基地，根据市委市政府《吉林市产业链链长制工作方案》《全市产业链招商引资攻坚专项行动方案》《2022年吉林市科技创新发展计划指南》文件精神，设立本专项指南，具体如下：一、项目类别（一）战略研究软科学专项1.吉林市碳纤维及复合材料检验检测中心可行性研究和方案设计；2.吉林市碳纤维产业知识产权战略布局研究；3.碳纤维及复合材料技术标准研究；4.利用大数据分析基于丙烯腈价格的下游产品定价机制研究；（二）中国（吉林化纤杯）碳纤维复合材料设计与应用创新创业大赛为促进吉林市大丝束碳纤维的推广应用，吸引国内外高校、科研院所以及中小企业充分了解和利用大丝束碳纤维进行产品开发与应用创新，支持由中国化纤协会等单位主办，吉林化纤集团公司等单位承办的“中国（吉林化纤杯）碳纤维复合材料设计与应用创新创业大赛。由大赛承办单位吉林化纤集团公司定向申报。（三）碳纤维及复合材料产业科技创新专项1.建立碳纤维试验线解决聚合、纺丝、碳化的试验线，具备配方调整，湿法、干法纺丝，蒸汽牵伸、油剂、上浆剂调配、碳化表征等功能。满足1k-50k碳化需要，且强度能够稳定达到T700级以上，碳化温度不低于1800℃。申报要求：申请资金额度不超过600万元，且需要申报单位提供1：1配套资金。2.新型碳纤维开发（1）PAN基中空碳纤维原丝技术研发。技术指标：原丝纤度在1dtex左右，空心直径在100nm以下。（2）沥青基碳纤维原料技术研发。技术指标：标模型拉伸弹性模量220～260GPa，拉伸强度1000～2000MPa，直径11μm。3.大丝束碳纤维上浆剂树脂体系研发及产业化（1）拉挤型材大丝束碳纤维专用树脂的浸润及固化优化研究。针对拉型材产品要求，给出拉挤速度（≥0.4m/min）、树脂配比、浸润温度、固化温度最佳工艺参数。（2）拉挤型材大丝束碳纤维专用上浆剂技术优化研究。技术指标：大丝束碳纤维复材制品层间剪切强度平均值≥60MPa，90°拉伸强度平均值≥50MPa，上浆后的碳丝表面能≥30J/m^2。（3）碳纤维用聚双环戊二烯（DCPD）上浆剂研发。技术指标：T400级碳纤维/聚双环戊二烯（DCPD）复合材料层间剪切强度≥50MPa；抗拉强度＞1000MPa，弹性模量＞100GPa，弯曲强度＞800MPa。4.碳纤维原丝及碳丝质量提升攻关提高大丝束碳纤维强度并缩短预氧化时间的生产技术研发。预氧化时间可控制在40分钟内制得均质碳纤维，均质化后48K大丝束碳纤维的力学性能技术指标：体密度≥1.78±0.02g/cm³，拉伸强度≥4.50GPa，拉伸模量≥230.00GPa，断裂拉长率≥1.80%。5.碳纤维应用领域技术研发及产业化（1）速钻碳纤维短纤桥塞技术研发。技术指标：耐井下温度150℃，耐承载压力70MPa。（2）非金属内胆25K及以上碳纤维缠绕Ⅳ型氢气瓶关键技术研发。技术指标：气瓶的公称工作压力≥35MPa，结构减重30%以上。（3）下一代动车组转向架碳纤维板弹簧技术研发。技术指标：刚度达到1000N/mm，满足空车载荷52.4kN，定员载荷61.4kN，空车载荷高165mm。（4）碳纤维直升机防砂滤组件的研发及产业化。技术指标：气体流量：5g/S，压力损失：105mm水柱，分离效率：90%。（5）碳纤维二维编织复合材料义肢技术研发。技术指标：拉伸强度≥55.2Mpa，弯曲强度≥89Mpa，冲击强度≥12x104J/m2，弹性模量≥980Mpa。（6）碳纤维箱包制造新工艺研究。6.PAN基碳纤维生产环节工业废气无害化处理研究。技术指标：满足《大气污染物综合排放标准》（GB16297-1996）、《恶臭污染物排放标准》（GB14554-93）。7.其它方面利用人工智能、大数据、云计算、互联网等技术建设智能工厂，开展碳纤维产业链装备关键技术攻关；为降低企业用电成本，支持碳纤维产业能源优化系统技术研发。（四）碳纤维产业链发展支撑围绕吉林市建设国际碳纤维及复合材料产业基地，支持《吉林国际碳纤维及复合材料产业基地发展规划》编制，吉林碳纤维产业链招商云平台建设，吉林碳纤维产业链招商项目策划包装。本部分项目将根据有关规定公开招标，项目资金数额根据招标结果确定。二、申报要求1.驻吉高校、吉林市城区（开发区）企业均可申报，支持高校和企业联合申报，配套资金不低于项目资金50%；2.申报项目属合作开发的，各方须签订相关技术合同（协议），优先支持上下游产业链和产学研合作项目；3.项目负责人一般应具备副高级（含副高级）以上专业技术职称；4.其他申报要求参照《2022年吉林市科技创新发展计划指南》规定执行。三、资助额度战略研究软科学专项不超过10万元/项；中国（吉林化纤杯）碳纤维复合材料设计与应用创新创业大赛20万/年；碳纤维产业科技创新专项中行业探索项目不超过20万元/项，产业化中试项目不超过50万元/项。四、资助方式一次性给予无偿资金支持。五、项目执行周期战略研究软科学专项执行周期1年，中国（吉林化纤杯）碳纤维复合材料设计与应用创新创业大赛执行周期1年，碳纤维产业科技创新专项执行周期2年。六、申报材料1.吉林市科技创新发展计划项目申报书；2.项目可研报告；3.提供产学研合作有关协议；4.中国（吉林化纤杯）碳纤维复合材料设计与应用创新创业大赛提供组织方案。七、申报截止时间2021年5月30日；中国（吉林化纤杯）碳纤维复合材料设计与应用创新创业大赛参赛项目申报要求另行发文件通知。八、受理与咨询电话碳纤维产业推进处联系人：任秋丽电话：62048989
1,吉林省交通运输厅关于组织开展交通运输行业2019年节能宣传周和低碳日活动的通知,"吉林省交通运输厅关于组织开展交通运输行业2019年节能宣传周和低碳日活动的通知吉林省交通运输厅关于组织开展交通运输行业2019年节能宣传周和低碳日活动的通知各市（州）交通运输局，厅有关单位：按照《关于2019年全国节能宣传周和全国低碳日活动的通知》（发改环资[2019]999号）、《关于开展2019年全省节能宣传周和低碳日活动的通知》（吉发改环资联[2019]390号）、《交通运输部办公厅关于组织开展交通运输行业2019年全国节能宣传周和全国低碳活动日活动的通知》（交办规划函[2019]858号）、《关于印发<2019年全省公共机构节能宣传周活动实施方案>的通知》（吉管发[2019]31号）文件要求，为做好2019年交通运输行业节能宣传周和低碳日活动，有关工作安排如下：一、紧扣主题，周密组织各单位要根据节能宣传周主题，制定宣传工作方案，组织开展具有行业特点的宣传活动，提高全社会节能意识和节能能力，助力生态文明和交通强国建设。地方交通运输部门围绕交通运输节能减排为重点，高建局、公路局、吉高集团围绕推进绿色公路、节能低碳新技术和新产品应用等为重点，运输局、海事局围绕新能源汽车、船舶推广应用，打好柴油货车污染治理攻坚战等为重点，路政局围绕治超等为重点，总结绿色交通发展方面的成效经验，积极向《中国交通报》“绿野通途""专栏投稿（至少一篇），广泛宣传我省先进经验和亮点。同时，各单位要围绕《交通运输行业重点节能低碳技术推广目录》推广工作，组织本地区、本单位召开绿色交通创新技术交流会，选取行业内典型节能低碳新技术、新工艺等进行经验介绍和交流，推动节能低碳技术的规模化应用，保障交通运输绿色低碳发展。二、形式丰富，广泛宣传各单位积极协调本地广播、电视、报纸、网络等新闻媒体，积极宣传本地区绿色交通发展成就、建设成果和节能减排突出亮点，广泛动员交通运输职工、企事业单位共同参与，确保活动取得良好的宣传效果。三、厉行节约，反对浪费要坚决贯彻执行中央八项规定精神和部有关要求，既保证宣传活动有声势有影响，又坚持勤俭节约办活动。7月10日前，各单位将活动方案、宣传成果和书面总结材料报送省厅。（联系人：厅综合规划处刘文阁，电话：85097531）附件：1.《关于开展2019年全省节能宣传周和低碳日活动的通知》（吉发改环资联[2019]390号）.pdf2.《交通运输部办公厅关于组织开展交通运输行业2019年全国节能宣传周和全国低碳活动日活动的通知》（交办规划函[2019]858号）.pdf3.《关于印发2019年全省公共机构节能宣传周活动实施方案的通知》（吉管发[2019]31号）.pdf4.交通运输行业重点节能低碳技术推广目录（2019年度）.pdf吉林省交通运输厅2019年6月21日"
2,吉林省人民政府关于下达各市(州)“十三五”碳排放强度降低目标的通知,吉林省人民政府关于下达各市(州)“十三五”碳排放强度降低目标的通知吉林省人民政府关于下达各市（州）“十三五”碳排放强度降低目标的通知（吉政明电〔2017〕1号）各市（州）人民政府：《国务院关于印发“十三五”控制温室气体排放工作方案的通知》（国发〔2016〕61号），下达我省“十三五”碳排放强度降低目标为18％。为确保完成目标，进一步优化和调整产业结构和能源结构，节约能源和提高能效，增加森林碳汇，积极应对气候变化，现将各市（州）“十三五”碳排放强度降低目标下达给你们，请认真遵照执行。附件：吉林省各市（州）“十三五”碳排放强度降低目标吉林省人民政府2017年1月5日
