,title,content
12,吉林省发展改革委关于《长春莲花山生态旅游度假区低碳发展规划(2014—2020)》的批复,"吉林省发展改革委关于《长春莲花山生态旅游度假区低碳发展规划(2014—2020)》的批复吉林省发展改革委关于《长春莲花山生态旅游度假区低碳发展规划(2014―2020)》的批复吉发改环资[2014]89号长春市发展和改革委员会：你委《关于上报<长春莲花山生态旅游度假区低碳发展规划（2014-2020）>的请示》(长发改环资[2014]11号)收悉，根据专家对《长春莲花山生态旅游度假区低碳发展规划（2014-2020）》（以下简称《规划》）的论证意见，经研究，现批复如下：一、原则上同意《规划》。二、《规划》以党的十八大和十八届三中全会及省委十届三次会议精神为指导，以生态文明建设和转变经济发展方式为主线，提出了长春莲花山生态旅游度假区的低碳发展目标、空间布局、重点产业和保障措施，较为合理，具有可行性，符合《吉林省“十二五""控制温室气体排放综合性实施方案》要求，对于积极应对气候变化，实现低碳发展，建设生态文明具有重要意义。三、《规划》在分析长春莲花山旅游度假区低碳发展的优势和挑战的基础上，划分了五大功能分区，提出了低碳旅游、低碳商贸服务、低碳商务会议会展、低碳宜居和低碳农业等重点发展的低碳产业，符合园区实际，对园区的低碳发展具有较强的指导作用。请你委抓紧组织实施规划，按照国家相关要求和程序办理园区建设各项手续，加快规划项目的实施，努力把莲花山区域建设成山水特征明显、城镇功能完备、低碳特色鲜明、服务要素齐全、现代产业活跃的生态山水新城，为全省低碳旅游产业提供示范。吉林省发展改革委2014年2月21日"
13,吉林省发展改革委关于吉林三源化工有限公司年产6万吨二硫化碳项目节能报告的审查意见,吉林省发展改革委关于吉林三源化工有限公司年产6万吨二硫化碳项目节能报告的审查意见吉林省发展改革委关于吉林三源化工有限公司年产6万吨二硫化碳项目节能报告的审查意见吉发改审批[2019]138号长岭县发展改革局：你局《关于吉林三源化工有限公司年产6万吨二硫化碳项目节能报告的请示》（长发改发﹝2019﹞3号）收悉。该项目（项目代码：2017-220722-26-03-013808）总投资20249.30万元，总建筑面积8490.09平方米，设计生产能力6万吨/年二硫化碳，新建天然气净化工序、液硫储存及过滤工序、合成工序、硫磺回收工序（含尾气处理及溶剂再生）等生产装置，新增设备311台（套）。根据省节能评审中心《关于报送<吉林三源化工有限公司年产6万吨二硫化碳项目节能报告评审意见>的报告》（吉能评﹝2019﹞16号），经审查，具体意见如下：一、原则同意该项目节能报告。二、该项目年综合能源消费量约37216吨标准煤，其中电力约1175万千瓦时，天然气约2946万立方米。计入松原市能源消费量。三、建设单位应严格落实节能报告各项措施，改进和加强以下节能工作：（一）应采用自动控制系统；天然气净化工序应采用变压吸附系统；应合理利用反应炉、焚烧炉烟气余热产生蒸汽，提高加热炉效率；冷水机组应采用螺杆机组；蒸汽及凝结水管道、热水管道应采用离心玻璃棉保温材料；低压侧应安装无功自动补偿装置；照明系统应采用分区控制方式，选用LED灯。（二）选用高效节能设备。要选用达到国家1级能效标准的产品和设备，将能效指标作为重要的技术指标列入设备招标文件和采购合同。（三）切实加强节能管理。根据《能源管理体系要求》（GB/T-23331），建立健全能源管理体系；根据《用能单位能源计量器具配备和管理通则》（GB17167），严格配备能源计量器具，建立三级能源计量管理体系。四、请你局依据本审查意见和项目最终修改后的节能报告，对项目设计、施工、竣工验收以及运营管理进行有效监督检查，及时报告本审查意见落实情况和项目有关重大事项。五、我委将适时对项目节能审查意见的落实情况进行跟踪检查。六、本审查意见自印发之日起2年内有效。在审查意见有效期内未开工建设的，项目单位应在审查意见有效期届满前的30个工作日之前向我委申请延期。项目在审查意见有效期内未开工建设也未按规定申请延期的，或虽提出延期申请但未获批准的，本审查意见自动失效。吉林省发展改革委2019年6月14日
14,吉林省发展改革委关于吉林中溢碳素科技有限公司年产35万吨大规模超高功率石墨电极项目节能报告的审查意见,吉林省发展改革委关于吉林中溢碳素科技有限公司年产35万吨大规模超高功率石墨电极项目节能报告的审查意见吉林省发展改革委关于吉林中溢碳素科技有限公司年产35万吨大规模超高功率石墨电极项目节能报告的审查意见吉发改审批[2020]1号柳河县发展改革局：你局《关于申请审查吉林中溢碳素科技有限公司年产3.5万吨大规模超高功率石墨电极项目节能报告的请示》（柳发改字﹝2019﹞139号）收悉。该项目（项目代码：2019-220524-41-03-006901）总投资81816万元，总占地面积105894平方米，总建筑面积62960平方米，主要建设环式焙烧炉车间、浸渍车间、石墨化车间、机加工车间、压型车间、配料混捏楼、库房、办公楼等，并配套相关附属设施。根据吉林省节能评审中心《关于报送<吉林中溢碳素科技有限公司年产3.5万吨大规模超高功率石墨电极项目节能报告评审意见>的报告》（吉能评﹝2019﹞51号），经审查，具体意见如下：一、原则同意该项目节能报告。二、该项目年综合能源消费量约41639吨标准煤，其中电力约19013万千瓦时，天然气约1497万立方米，柴油约64吨。计入通化市能源消费量。三、建设单位应严格落实节能报告各项措施，改进和加强以下节能工作：（一）项目原料及产品仓库应靠近生产单元；动力设备布置应紧邻用能负荷中心；石墨电极本体应采用一浸二焙短流程工艺方案；接头生产应采用二浸三焙短流程工艺方案；石墨电极的一次焙烧应采用敞开式环式焙烧炉；二次焙烧应采用隧道窑；浸渍沥青应采用高软化点专用沥青；石墨化应采用内热串接石墨化炉；风机、水泵、空压机应采用变频调速装置。（二）选用高效节能设备。要选用达到国家1级能效标准的产品和设备，将能效指标作为重要的技术指标列入设备招标文件和采购合同。（三）切实加强节能管理。根据《能源管理体系要求》（GB/T-23331），建立健全能源管理体系；根据《用能单位能源计量器具配备和管理通则》（GB17167），严格配备能源计量器具，建立三级能源计量管理体系。四、请你局依据本审查意见和项目最终修改后的节能报告，对项目设计、施工、竣工验收以及运营管理进行有效监督检查，及时报告本审查意见落实情况和项目有关重大事项。五、我委将适时对项目节能审查意见的落实情况进行跟踪检查。六、本审查意见自印发之日起2年内有效。在审查意见有效期内未开工建设的，项目单位应在审查意见有效期届满前的30个工作日之前向我委申请延期。项目在审查意见有效期内未开工建设也未按规定申请延期的，或虽提出延期申请但未获批准的，本审查意见自动失效。吉林省发展改革委2020年1月3日
15,吉林省地方税务局关于二氧化碳气资源税税额标准的批复,吉林省地方税务局关于二氧化碳气资源税税额标准的批复吉林省地方税务局关于二氧化碳气资源税税额标准的批复（吉地税发[2011]86号）长春市地方税务局：你局《关于二氧化碳资源税税额标准的请示》（长地税发〔2011〕85号）收悉，经研究，批复如下：根据《中华人民共和国资源税暂行条例实施细则》〔（93）财法字第43号〕附表一中税目四（九）和《国家税务总局关于印发〈资源税几个应税产品范围问题的解答〉的通知》（国税函发〔1997〕628号）第四条之规定，二氧化碳气资源税适用税额标准为3元/立方米。2011年8月9日
16,吉林省工信厅、吉林省发改委关于转发工业和信息化部发展改革委关于组织开展国家低碳工业园区试点工作的通知,吉林省工信厅、吉林省发改委关于转发工业和信息化部发展改革委关于组织开展国家低碳工业园区试点工作的通知吉林省工信厅、吉林省发改委关于转发工业和信息化部发展改革委关于组织开展国家低碳工业园区试点工作的通知（吉工信办联〔2013〕66号）各市（州）工信局、发改委，梅河口市经济局、发改局，公主岭市经济局、发改局，珲春国际合作示范区工信局：为贯彻落实《国务院关于印发“十二五”控制温室气体排放工作方案的通知》和《工业领域应对气候变化行动方案（2012-2020年）》，工业和信息化部、发展改革委决定组织开展低碳工业园区试点工作，现将《关于组织开展国家低碳工业园区试点工作的通知》（工信部联节〔2013〕408号）和《国家低碳工业园区试点工作方案》转发给你们，请按要求组织园区申报，并就有关事项通知如下：一、加强组织领导各市（州）工信局、发改局要充分认识开展低碳工业园区试点工作的重要意义，加强领导，密切配合，明确任务，落实责任，确保申报工作的质量和进度。二、申报园区范围申报单位必须是列入《中国开发区审核公告目录》中的国家新型工业化示范基地，以工业为主的经济技术开发区和高新技术开发区。三、申报程序各市（州）工信局、发改委负责组织符合条件的园区进行申报，指导园区按照试点工作方案的要求编写试点申报材料，并对园区申报材料的合规性、完整性、真实性进行初审，汇总后联合行文上报省工信厅和省发改委。省工信厅和省发改委联合进行初选，确定推荐园区名单后，将有关材料上报工业和信息化部和国家发展改革委。四、材料上报时间请各市（州）务必于2013年11月20日前将各项目材料一式八份分别报送省工信厅资源处（四份）和省发改委环资处（四份），同时提供全部材料电子版，逾期不予受理。五、联系方式省工信厅资源处：孙一明0431-88914475jlzy8904578@163.com省发改委环资处王农0431-88905975jlstb@sina.com附件：《工业和信息化部发展改革委关于组织开展国家低碳工业园区试点工作的通知》（工信部联节〔2013〕408号）（略）2013年11月5日
17,吉林省政务服务和数字化建设管理局关于印发吉林省实施节能降碳技术改造数据中心、能效先进数据中心清单的通知,"吉林省政务服务和数字化建设管理局关于印发吉林省实施节能降碳技术改造数据中心、能效先进数据中心清单的通知吉林省政务服务和数字化建设管理局关于印发吉林省实施节能降碳技术改造数据中心、能效先进数据中心清单的通知数字吉林办〔2022〕9号省直有关部门，各市（州）、长白山管委会、长春新区管委会、梅河口市政务服务和数字化建设管理局：根据《关于印发严格能效约束推动重点领域节能降碳行动方案的通知》（吉发改产业联〔2021〕978号）要求，经过对全省数据中心能效摸底等相关工作，确定了“吉林省实施节能降碳技术改造数据中心（20机架以上）清单（第一批）""（以下简称技术改造清单），“吉林省2022年能效先进数据中心（20机架以上）清单""（以下简称能效先进清单），现予以印发执行，具体事宜通知如下：一、技术改造数据中心管理工作要求（一）各地、各有关部门要根据技术改造清单，组织相关单位于6月30日前完成“一企一策""具体改造方案，要明确技术改造路线、工作计划，落实好改造所需资金。（二）各地、各有关部门要按照“电能利用效率不高于1.5""的目标，组织相关单位积极、有序、稳妥地实施数据中心节能降碳技术改造，确保在规定时限内完成改造任务，鼓励有条件的单位先行先试，提前完成改造任务。（三）完成节能降碳技术改造任务的数据中心，由相关单位向牵头部门提报，牵头部门向省政务服务和数字化局上报，省政务服务和数字化局组织专家进行论证。（四）在规定时限内因特殊原因不能完成节能降碳技术改造任务的数据中心，由相关单位向牵头部门提报，牵头部门向省政务服务和数字化局提出延期申请，省政务服务和数字化局组织专家进行论证，论证通过的可适当延期。（五）各地、各有关部门要定期调度了解牵头推动的数据中心节能降碳技术改造情况、实际电能利用效率情况等，并于每年6月30日、12月30日前分别向省政务服务和数字化局报送工作进展情况。二、能效先进数据中心管理工作要求（一）对能效先进清单实施动态管理，根据数据中心电能利用效率情况，每年年底更新、调整一次。（二）各地、各有关部门要加强对能效先进数据中心的日常监管，有关部门每年对数据中心能效指标进行抽查，并适时将抽查结果进行通报。“数字吉林""建设领导小组办公室2022年6月6日1.吉林省实施节能降碳技术改造数据中心（20机架以上）清单（第一批）.xlsx2.吉林省2022年能效先进数据中心（20机架以上）清单.xlsx"
18,吉林省文化和旅游厅关于开展“绿色低碳，节能先行”宣传周活动的总结,"吉林省文化和旅游厅关于开展“绿色低碳，节能先行”宣传周活动的总结吉林省文化和旅游厅关于开展“绿色低碳，节能先行”宣传周活动的总结吉文旅函〔2022〕85号省机关事务管理局：根据《关于开展2022年全省公共机构节能宣传周有关活动的通知》（吉管发〔2022〕25号）通知要求，省文化和旅游厅下发了《吉林省文化和旅游厅关于开展宣传周活动的通知》，要求厅直各单位围绕主题，组织开展各类宣传周活动，广泛传播节能理念，积极营造了节能降碳的浓厚氛围，以实际行动践行了低碳节能。现将活动开展情况总结如下：一、多措并举，营造氛围本次活动期间，厅机关各处（室）、省直各单位围绕“绿色低碳，节能先行""活动主题，通过电子屏、微信群、短视频等新的宣传阵地，滚动播放“绿色低碳，节能先行""宣传图片、节能宣传短片，让低碳节能意识入心入脑；制作宣传海报，悬挂在醒目位置，加大力度宣传活动主题；厅直各单位参加并在线学习省机关事务管理局组织的节能科普专题讲座，宣传带动全省文旅系统，共同创建节能机关。二、创新载体，狠抓落实（一）践行绿色办公。厅机关、厅直各单位制作了节能“温馨提示""宣传卡，在电脑、电源开关、打印机上分别贴“节约每一度电""“请随手关闭电源""“节约每一张纸""等提示语，在卫生间醒目处张贴“节约用水，从我做起""的温馨提示。组织人员在中午和下午下班后对各处室的低碳践行情况进行检查，从检查结果看，没有出现“长明灯""“长流水""现象，电脑、空调等均及时关闭。（二）体验能源紧缺。厅机关各处（室）、厅直各单位通过停开空调一天；停开公共场所（走廊、卫生间）照明一天；办公室、会议室少开照明灯；限制打印纸数量，提倡反正面打印。通过体验活动，大家切身感受到了能源紧张给我们生活、工作带来的诸多不便，切实强化了广大干部的节能意识，以实际行动为低碳节能贡献自己的一份力量。（三）践行低碳出行。6月15日“全国低碳日""，厅机关、厅直各单位工作人员积极响应本次活动号召，选择乘坐公共交通、骑自行车、步行上班，亦或是就近拼车上班。“拼车""出行既节约资源又缓解了机关停车场压力，“拼出""了低碳生活。三、加强管理，长效监督省文旅厅以此次宣传周活动为契机，开展了节能制度落实情况的专项督查，重点督查广大干部的节能意识、节能行为、节能设施等，通过督导检查，发现问题及时纠正，将节能低碳作为一项常态化工作来抓，不断将建设节能机关工作推向深入。通过开展此次节能宣传周活动，进一步提高了厅直文旅系统广大干部的节能意识，为节能工作深入开展奠定了良好基础，达到了预期目的。宣传周过后，我们将继续把践行“绿色低碳，节能先行""意识与行动贯穿到今后的工作和生活中，为建设生态吉林贡献自己的力量。吉林省文化和旅游厅2022年6月21日"
19,吉林省文化和旅游厅关于开展“绿色低碳，节能先行”宣传周活动的通知,"吉林省文化和旅游厅关于开展“绿色低碳，节能先行”宣传周活动的通知吉林省文化和旅游厅关于开展“绿色低碳，节能先行”宣传周活动的通知吉文旅发〔2022〕163号各处（室）、直属各单位：6月13日至19日是全国第32个节能宣传周，本次活动主题是“绿色低碳，节能先行""。根据《关于开展2022年全省公共机构节能宣传周有关活动的通知》（吉管发〔2022〕25号）通知要求，为全面深入推进宣传周活动，广泛传播节能理念，大力倡导绿色低碳生产生活方式，积极营造节能降碳浓厚氛围，加快形成能源节约型社会，现向全省文旅系统工作人员发出如下倡议：一、争做“绿色低碳，节能先行""的宣传者。低碳生活无处不在，无处不有，走低碳之路，建设美丽长春，是我们共同的责任。广大党员干部要学习掌握、宣传低碳知识，提高低碳意识，树立低碳理念，倡导低碳生活，向身边人传递“绿色低碳，节能先行""信息，带动更多人参与到行动中来，让我们的家园多一片蓝天，多一片绿色。二、争做“绿色低碳，节能先行""的践行者。全省文旅系统工作人员要从身边小事做起，从点滴做起，每天节约一滴水、一度电、一张纸；停开公共区域照明；购物时选用环保袋，少用塑料袋；就餐时拒绝使用一次性筷子；夏季空调温度设置不低于26度；出门时提前关闭电源、办公照明等，真正把环保行为融入每个人的学习、生活、工作中。三、争做“绿色低碳，节能先行""的倡导者。倡导全省文旅系统工作人员就近拼车，“拼出""低碳生活。同事之间结成对子拼车出行，一来可节省不少开销，二来可缓解机关内部停车场压力，可谓一举两得。人不负青山、青山定不负人。让我们行动起来，从我做起、从现在做起、从点滴做起，积极践行简约适度、绿色低碳、文明健康的工作、生活方式，为加快建设绿色低碳、生态宜居的现代化城市贡献力量！吉林省文化和旅游厅2022年6月16日"
