,title,content
23,吉林省科技厅关于召开碳纤维复合材料重大科技专项论证会的通知,吉林省科技厅关于召开碳纤维复合材料重大科技专项论证会的通知吉林省科技厅关于召开碳纤维复合材料重大科技专项论证会的通知各有关单位：为深入贯彻落实省政府碳纤维产业发展专题会议决策部署，促进吉林省碳纤维及复合材料产业高质量发展，省科技厅决定组织实施碳纤维复合材料重大科技专项。并于10月16日组织召开碳纤维复合材料重大科技专项论证会，有关事宜通知如下：一、组织实施碳纤维复合材料重大科技专项项目的原则一是坚持“三个原则”。坚持重大性，即项目应是支撑碳纤维产业高质量发展关键核心技术，能够产生重大经济社会效益。对碳纤维高质量发展和打造中国（吉林）碳纤维高新技术产业化基地具有支撑和引领作用。坚持技术的先进性，即项目要符合碳纤维产业的发展趋势，对碳纤维产业强链、壮链、补链、延链具有战略性支撑作用。坚持成果的可用性，即项目应是碳纤维产业高质量发展的现实科技创新需求，项目完成后马上就能转化为现实生产力。二是坚持“四个导向”。坚持市场导向，即项目要紧盯碳纤维产业高质量发展的重大科技需求，科学布局各类创新要素。坚持企业技术创新主体导向，即企业是提出项目的主体、经费投入的主体、成果应用的主体和研发决策的主体。坚持产学研深度融合导向，即组织开展产学研用协同创新，推动产业链上下游、产学研深度融合，聚集社会上最优质碳纤维科技创新资源，集中力量攻克一批强优势和“卡脖子”关键核心技术。坚持参照揭榜挂帅机制导向，即参照项目管理新机制，进一步激发人才创新创造活力，提升碳纤维科技自主创新能力，充分发挥科技专项资金的杠杆作用，提高科技创新专项资金的使用绩效。二、碳纤维复合材料重大科技专项重大项目课题论证答辩要求一是碳纤维复合材料重大科技专项重大项目提出单位请按照重大专项项目建议书格式准备10分钟PPT答辩材料，同时，现场提供15份碳纤维重大科技专项重大项目建议书。二是每个项目答辩时间15分钟，其中，项目负责人自述10分钟，专家咨询5分钟。三是碳纤维复合材料重大科技专项重大项目建议书负责人必须到会议现场答辩。三、防疫要求一是自10月3日以来去过中高风险地区的人员禁止参加会议。二是参会人员需要测量体温，并查验吉祥码和行程码。四、专项论证会时间和地点会议时间：2021年10月16日上午7：30--12：00。会议地点：吉林省科技厅一楼第三会议室（长春市民康路522号）五、会议联系人与联系方式杨景鹏0431-8963422018686663677吉林省科技厅2021年10月13日
24,吉林省科技厅关于征集节能减排与低碳技术成果的通知,吉林省科技厅关于征集节能减排与低碳技术成果的通知吉林省科技厅关于征集节能减排与低碳技术成果的通知各有关单位：按照科技部《关于征集节能减排与低碳技术成果的通知》（国科社函[2014]149号）要求，现公开征集我省节能减排与低碳技术成果，进行第二批《节能减排与低碳技术成果转化推广清单》编制工作，具体要求详见科技部网站http：//www.most.gov.cn/tztg/201411/t20141124_116710.htm。请各申报单位于本周四（11月27日）前将申报材料纸质版2份、刻录光盘1份报送至省科技厅社会发展处（230房间）。申报材料电子版发送至jlkjtsfc@163.com。联系人：吉林省科技厅社会发展处陈松电话：0431-88975413吉林省科学技术厅2014年11月24日
25,吉林省财政厅关于下达2022年中央基建投资(污染治理和节能减碳专项——污染治理方向)预算的通知,吉林省财政厅关于下达2022年中央基建投资(污染治理和节能减碳专项——污染治理方向)预算的通知吉林省财政厅关于下达2022年中央基建投资（污染治理和节能减碳专项--污染治理方向）预算的通知（吉财建指〔2022〕655号）有关市（县）财政局：根据《财政部关于下达2022年污染治理和节能减碳专项（污染治理方向）中央基建投资预算的通知》（财建〔2022〕256号）、《吉林省发展改革委关于下达污染治理和节能减碳专项（污染治理方向）2022年中央预算内投资计划的通知》（吉发改投资〔2022〕465号），现下达2022年中央基建投资资金10800万元，专项用于污染治理和节能减碳专项（污染治理方向）。收支分类科目、具体内容等请详见附件。请按照《中共中央国务院关于全面实施预算绩效管理的意见》（中发〔2018〕34号）要求，参照中央资金绩效目标，会同发改等部门科学合理设计本级绩效目标，确保绩效目标如期实现，并将有关绩效目标和指标报省财政厅备案。按照《吉林省基本建设财务管理暂行办法》（吉财建〔2016〕859号）规定，切实加强资金管理监督，专款专用，不得截留或挪作他用，确保项目建设顺利实施。附件1：2022年中央基建投资预算表附件2：绩效目标表吉林省财政厅2022年8月12日附件1：2022年中央基建投资预算表单位：万元附件2：绩效目标表（可自行修改）（年度）填报单位（盖章）预算部门（盖章）填报日期：年月日
26,吉林省财政厅关于下达2022年中央基建投资(污染治理和节能减碳专项——节能减碳方向第二批)预算的通知,吉林省财政厅关于下达2022年中央基建投资(污染治理和节能减碳专项——节能减碳方向第二批)预算的通知吉林省财政厅关于下达2022年中央基建投资（污染治理和节能减碳专项--节能减碳方向第二批）预算的通知（吉财建指〔2022〕728号）有关市（县）财政局：根据《财政部关于下达2022年污染治理和节能减碳专项（节能减碳方向）第二批中央基建投资预算的通知》（财建〔2022〕280号）、《吉林省发展改革委关于下达污染治理和节能减碳专项（节能减碳方向）2022年第二批中央预算内投资计划的通知》（吉发改投资〔2022〕511号），现下达2022年中央基建投资资金2190万元，专项用于污染治理和节能减碳专项（节能减碳方向）。收支分类科目、具体内容等请详见附件。请按照《中共中央国务院关于全面实施预算绩效管理的意见》（中发〔2018〕34号）要求，参照中央资金绩效目标，会同发改等部门科学合理设计本级绩效目标，确保绩效目标如期实现，并将有关绩效目标和指标报省财政厅备案。按照《吉林省基本建设财务管理暂行办法》（吉财建〔2016〕859号）规定，切实加强资金管理监督，专款专用，不得截留或挪作他用，确保项目建设顺利实施。附件1：2022年中央基建投资预算表附件2：绩效目标表吉林省财政厅2022年9月9日附件1：2022年中央基建投资预算表单位：万元附件2：绩效目标表（可自行修改）（年度）填报单位（盖章）预算部门（盖章）填报日期：年月日
27,四平市人民政府关于下达2012年节能目标及“十二五”单位GDP二氧化碳排放下降指标的通知,四平市人民政府关于下达2012年节能目标及“十二五”单位GDP二氧化碳排放下降指标的通知四平市人民政府关于下达2012年节能目标及“十二五”单位GDP二氧化碳排放下降指标的通知（四政发〔2012〕16号）各县（市）、区人民政府，辽河农垦管理区、各开发区管委会，市政府各委办局、各直属机构：根据《吉林省人民政府关于下达全省2012年节能目标的通知》（吉政明电〔2012〕3号）和《吉林省人民政府关于下达各市（州）“十二五”单位GDP二氧化碳排放指标的通知》（吉政明电〔2011〕16号）精神，现将我市各县（市）、区和各重点领域2012年节能目标及“十二五”单位GDP二氧化碳排放下降指标下达给你们，请认真抓好落实，确保完成任务。具体指标情况如下：一、2012年各县（市）、区节能目标按照“同地区承担相同节能目标”的原则，2012年，公主岭市、梨树县、伊通满族自治县、双辽市、铁东区、铁西区、辽河农垦管理区、四平经济开发区、红嘴经济技术开发区节能目标单位GDP能耗同比下降3.5%。二、2012年各重点领域节能目标农业单位增加值能耗同比下降0.41%；工业单位增加值能耗同比下降4.13%；建筑业单位增加值能耗同比下降3.43%；交通运输业营运客车单位运输周转量能耗同比下降1.3%（交通部统一考核指标）；商业流通业单位增加值能耗同比下降4.37%；公共机构人均能耗下降2%；单位建筑面积能耗下降2%。三、“十二五”期间各县（市）单位GDP二氧化碳排放下降指标安排情况“十二五”期间，公主岭市、梨树县、伊通满族自治县、双辽市、铁东区、铁西区、辽河农垦管理区、四平经济开发区、红嘴经济技术开发区单位GDP二氧化碳排放下降指标为同比下降17.3%。其中2011年同比下降3.73%，2012年同比下降3.73%，2013年同比下降3.73%，2014年同比下降3.73%，2015年同比下降3.72%。二〇一二年五月七日
