,title,content
0,乐山市人民政府关于下达“十二五”碳强度下降目标的通知,乐山市人民政府关于下达“十二五”碳强度下降目标的通知乐山市人民政府关于下达“十二五”碳强度下降目标的通知各区、市、县、自治县人民政府，乐山高新区管委会、峨眉山-乐山大佛景区管委会，市级各部门：控制温室气体排放是国家积极应对全球气候变化的重要任务，对于加快转变经济发展方式、促进经济社会可持续发展、推进新的产业革命具有重要意义。按照《四川省人民政府关于下达“十二五”各市（州）碳强度下降目标的通知》（川府发〔2011〕31号）精神，我市“十二五”单位GDP（生产总值）二氧化碳排放需下降18.5%。为确保完成全市碳强度下降目标，现将目标下达各县（市、区）。各县（市、区）政府对本行政区域内控制温室气体排放工作负总责，政府主要领导是第一责任人。要将控制温室气体排放纳入本地总体工作布局，加强领导，强力推进，确保完成目标任务。要综合运用经济、法律、技术和必要的行政手段，加强二氧化碳减排统计、监测和考核体系建设，健全激励约束机制。充分发挥市场机制作用，增强企业和社会各界控制温室气体排放的意识和自觉性，形成以政府为主导、企业为主体、全社会广泛参与的控制温室气体排放工作格局，确保顺利完成省下达我市的“十二五”碳强度下降目标。乐山市人民政府2012年9月21日附件：乐山市“十二五”期间各县（市、区）碳强度下降目标
1,凉山州人民政府办公室关于做好2015年及“十二五”节能减排降碳工作总结和2016年及“十三五”节能减排降碳工作计划的通知,凉山州人民政府办公室关于做好2015年及“十二五”节能减排降碳工作总结和2016年及“十三五”节能减排降碳工作计划的通知凉山州人民政府办公室关于做好2015年及“十二五”节能减排降碳工作总结和2016年及“十三五”节能减排降碳工作计划的通知（凉府办函〔2015〕357号）州级有关部门：为做好我州2015年及“十二五”节能减排降碳目标责任评价考核工作，并为2016年及“十三五”节能减排降碳工作谋好篇、布好局，现将有关工作事项通知如下。一、工作内容（一）总结2015年度及“十二五”节能减排降碳工作，提出2016年及“十三五”工作安排。各部门要对照国家、省节能目标责任评价考核指标，认真总结2015年度及“十二五”期间节能减排降碳工作的成绩和经验，研究提出本行业2016年及“十三五”节能减排降碳工作安排和目标，并形成书面报告。报告要求全面客观，分析深入透彻，措施具体可行。该报告将作为州政府2015年及“十二五”节能减排降碳目标责任评价考核的重要依据。（二）做好2015年及“十二五”节能降碳目标责任评价考核准备工作。各部门根据职能职责，按照《四川省“十二五”单位GDP能耗考核办法》《四川省“十二五”单位GDP二氧化碳排放降低目标责任评价考核办法》（见附件）要求，做好节能减排降碳目标责任评价考核自查，并形成自查报告；按照《万家企业节能目标责任考核实施方案》（发改办环资〔2012〕1923号）要求，组织开展万家企业节能目标责任考核工作。二、各部门需提供材料（一）2015年及“十二五”节能减排降碳工作总结和2016年及“十三五”工作安排。（二）根据节能目标责任评价考核指标及计分标准分解的内容，提供2015年及“十二五”节能降碳目标责任评价考核自查报告，并提供证明各项工作开展和完成情况的相关日常资料、记录、文件等材料复印件。三、报送时间请各部门于2015年12月22日前将相关材料（盖章）和电子文档报送州节能减排工作领导小组综合办公室（州发改委）。联系人及电话：谢军（州发展改革委环资科），0834-3238816；电子邮箱：lszfgwzhk@163.com。附件：1.四川省“十二五”单位GDP能耗考核办法（2015年度）一、总体要求围绕“十二五”节能目标任务，贯彻落实党中央、国务院和省委、省政府节能工作部署，按照目标明确、责任落实、措施到位、奖惩分明、逐级考核的要求，进一步健全节能目标责任评价、考核和奖惩体系，切实发挥政府主导、部门推动作用，以节能考核为引领，推动形成转变发展方式的倒逼机制，确保全省“十二五”单位地区生产总值能耗降低16%。二、考核对象、内容和方法（一）考核对象。各市（州）人民政府。（二）考核内容。主要包括节能目标完成情况和节能措施落实情况。（三）考核方法。采用量化办法，相应设置节能目标完成情况指标和节能措施落实情况指标，满分100分。节能目标完成情况为定量考核指标，以各市（州）年度节能目标、行业节能目标和“十二五”节能目标进度为基准，依据省统计局核定的市（州）节能目标完成情况评分，满分为40分。其中，年度节能目标指标分值10分，“十二五”节能目标进度指标分值20分，年度能耗增速控制目标分值10分，根据省统计局核定数据进行考核。节能措施落实情况为定性考核指标，主要包括目标责任、结构调整、重点工程、节能管理、技术推广、经济政策、监督检查、市场化机制推广、基础工作和能力建设等九个方面政策措施，满分为60分。（四）考核结果。分为超额完成（95分及以上，下同）、完成（80-95分）、基本完成（60-80分）、未完成（60分以下）四个等级。具体考核指标及打分标准见附件。三、考核程序（一）各市（州）人民政府按照《四川省人民政府办公厅关于印发四川省“十二五”节约能源规划的通知》（川办发〔2011〕78号）提出的“十二五”节能目标，确定年度节能目标，于2016年3月1日前报省节能减排工作领导小组办公室（以下简称节能减排办）备案，年度节能目标应结合能耗增量控制目标，不得低于本市（州）“十二五”节能目标平均进度要求。（二）2016年3月1日前，各市（州）人民政府将上年度本地区节能目标完成情况和节能措施落实情况自查报告报省政府，同时抄送省节能减排办。省发展改革委会同省经济和信息化委、科技厅、财政厅、住房城乡建设厅、交通运输厅、商务厅、省质监局、省统计局、省直机关事务管理局、省国资委等部门及专家组成评价考核工作组，通过书面审查、现场核查和重点抽查等方式，对各市（州）节能目标完成情况及节能措施落实情况进行评价考核和监督核查，形成综合评价考核报告，于2016年5月底前报省政府。四、奖惩措施（一）对各市（州）节能目标责任评价考核结果经省政府审定后，依照《四川省地方党政领导班子和领导干部综合考核评价办法》《四川省开展加快转变经济发展方式监督检查的意见》（川纪发〔2011〕15号）、《四川省人民政府关于开展政府绩效管理试点工作的意见》（川府函〔2011〕198号）等规定，交干部主管部门作为对市（州）人民政府领导班子和领导干部综合考核评价的重要内容、对市（州）人民政府节能减排政策措施落实情况监督整改的重要依据，以及对各市（州）人民政府节能绩效考评结果，实行问责制。（二）对考核等级为完成和超额完成的市（州）人民政府，给予通报表扬，并纳入全省节能表彰活动进行表彰奖励。对考核等级为未完成的市（州）人民政府，领导干部不得参加年度评奖、授予荣誉称号等，暂停对该地区新建高耗能项目的核准和审批。（三）考核等级为未完成的市（州）人民政府，应在评价考核结果公告后一个月内，向省政府做出书面报告，提出限期整改工作措施，并抄送省发展改革委。整改不到位的，依据有关规定追究该地区有关责任人员的责任。（四）对在节能考核工作中瞒报、谎报情况的地区，予以通报批评，对直接责任人员依法追究责任。附件：1-1.四川省市（州）人民政府节能目标责任评价考核指标及计分标准（2015年度）附件：2.四川省单位GDP二氧化碳排放降低目标责任评价考核办法（2015年度）根据国家《“十二五”控制温室气体徘放工作方案》和《四川省国民经济和社会发展第十二个五年规划纲要》，为强化政府责任和政策导向，努力完成控制温室气体排放的各项主要任务，扎实推进基础工作与能力建设，确保实现“十二五”单位国内生产总值二氧化碳排放降低目标，特制订本办法。一、总体思路按照责任落实、措施落实、工作落实的总体要求，遵循目标导向、突出重点、易于操作、奖惩分明的原则，建立单位GDP二氧化碳排放降低目标责任评价考核制度，加强对各市（州）“十二五”二氧化碳排放降低目标完成情况的评价考核。二、考核对象、内容和方法（一）考核对象：各市（州）人民政府。（二）考核内容：主要包括二氧化碳排放强度降低目标完成情况、任务与措施落实情况、基础工作与能力建设落实情况。（三）考核方法：釆用量化办法，相应设置目标完成、任务与措施、基础工作与能力建设等12项指标，满分100分；另设-项加分项，满分10分。其中：目标完成项，满分50分，考核各市（州）年度降低目标（不低于“十二五”目标任务平均进度）完成情况以及累计进度目标完成情况，2014-2015年碳排放增量控制目标完成情况，分别按目标完成率评分。任务与措施项，满分24分，考核各市（州）年度调整产业结构、节约能源和提高能效、调整能源结构、增加森林碳汇四项主要任务的完成情况和低碳试点示范建设情况。其中前四项主要任务完成指标以同期开展的考核结果作为评分依据，如相关部门没有进行考核，则依据本办法的评分细则评分。基础工作与能力建设项，满分26分，考核各市（州）对所辖地县（区、市）目标分解落实与评价考核，温室气体排放统计核算制度建设，重点企（事）业单位温室气体排放报告与核查工作进行情况，低碳产品标准、标识和认证制度，资金保障，组织领导和公众参与情况，均按评分细则评分。其他为加分项，满分10分，主要是对开展体制机制创新的地区，给予适当加分。具体考核指标及评分细则见附件。（四）考核结果。分为四个等级：60分以下为“未完成”，60-79分为“基本完成”，80-99分为“完成”，100分及以上为“超额完成”，其中“完成”和“超额完成”的前提条件是单位GDP二氧化碳排放年度降低目标和累计进度目标均如期完成。三、考核程序及方式考核分为考核对象自评、评价考核工作组初步审核、现场评价考核和考核结果审定与公布几个阶段。（一）考核对象自评，各市（州）根据本办法附件中的“十二五”市（州）人民政府控制温室气体排放目标责任评价考核指标及评分细则准备考核材料，填写“数据核查表”，开展自评估，并于3月底前将自评估报告报省应对气候变化工作领导小组，同时抄送省发展改革委、应对气候变化工作领导小组办公室。（二）评价考核工作组初步审核，省发展改革委会同省经济和信息化委、农业厅、林业厅、省统计局、省能源局等部门组成评价考核工作组，于2016年4月底前完成对各地提交的自评估报告和相关数据资料的初步审核。（三）现场评价考核，评价考核工作组于2016年3-4月赴各市（州）开展现场核查和重点抽查，形成综合评价考核报告，并反馈意见。（四）考核结果审定与公布。综合评价考核报告于2016年5月底前报省政府，各地区控制温室气体排放目标责任的评价考核结果经省政府审定后，由省发展改革委向社会公告。四、奖惩措施（一）对各地区控制温室气体排放目标责任的评价考核结果经省政府审定后，交由干部主管部门，作为对各市（州）人民政府主要负责人和领导班子综合考核评价的重要依据，实行问责制。（二）对考核等级为完成和超额完成的市（州）人民政府进行表彰。对考核等级为未完成的市（州）人民政府，应在评价考核结果公告后1个月内，向省应对气候变化工作领导小组做出书面报告，提出限期整改措施，并抄送发展改革委。整改期间，暂停对其辖区低碳试点示范、新建高耗能项目的审批。整改不到位的，由监察部门依法依纪追究该地区有关责任人员的责任。（三）对在控制温室气体排放评价考核工作中瞒报、谎报情况的地区，予以通报批评；对直接责任人员依法追究责任。附件：2-1四川省市（州）人民政府单位GDP二氧化碳排放降低目标责任评价考核指标及评分细则（2015年度）附件：2-2二氧化碳排放计算公式说明一、单位地区生产总值二氧化碳排放年度下降目标完成率指考核年度单位地区生产总值二氧化碳排放相比上年度的降低率（如相比上年实际增长则为负值）与政府预定的年度下降目标的比值。计算公式为：单位地区生产总值二氧化碳排放年度下降目标完成率＝（1-考核年度单位地区生产总值能源消费二氧化碳排放/上年度单位地区生产总值能源消费二氧化碳排放）/预定的年度下降目标×100%。二、“十二五”单位地区生产总值二氧化碳排放累计进度目标完成率指考核年度单位地区生产总值二氧化碳排放相比基期（即2010年）的降低率与当年应达到的累计进度目标的比值。计算公式为：累计进度目标完成率＝[（1-考核年度单位地区生产总值能源消费二氧化碳排放/2010年单位地区生产总值能源消费二氧化碳排放）/[1-（1-R）（T-2010）/5]×100%。式中，T指考核年度，R指国务院下达给各地区的“十二五”单位地区生产总值二氧化碳排放下降目标。附件：2-3二氧化碳排放核算方法及数据核查表一、核算范围及公式二氧化碳排放指化石燃料燃烧过程产生的排放量。核算公式为：二氧化碳排放量＝燃煤排放量＋燃油排放量＋燃气排放量＋电力调入二氧化碳排放量－电力调出二氧化碳排放量其中：燃煤排放量（吨二氧化碳）＝当年煤炭消费量（吨标准煤）×上次燃煤综合排放因子（吨二氧化碳/吨标准煤）燃油排放量＝当年油品消费量×上次燃油综合排放因子燃气排放量＝当年天然气消费量×上次燃气综合排放因子说明：单位化石燃料燃烧产生的二氧化碳排放理论上随着燃料质量、燃烧技术以及控制技术等因素的变化每年应该有所差异，考虑到年度数据获取的滞后性以及可比性，核算各市（州）二氧化碳排放的排放因子数据采用2005年国家温室气体清单的初步数据，见下表。2005年化石燃料燃烧过程CO2排放因子二、电力调入调出二氧化碳间接排放量核算电力调入调出二氧化碳净排放量＝电力调入二氧化碳排放量－电力调出二氧化碳排放量＝（调入电量×调入电网供电平均排放因子）－（调出电量×所在电网供电平均排放因子）其中：调入或调出电量数据可以从各市能源平衡表或电力平衡表获得，并以千瓦时为单位；区域电网供电平均排放因子建议按照国家对区域电网边界的划分方式，统一采用2005年国家对华中区域电网排放因子数据0.801（Kg/KW.h）。三、数据核查表凉山州人民政府办公室2015年12月15日
2,凉山州人民政府办公室关于做好防范一氧化碳中毒工作的紧急通知,"凉山州人民政府办公室关于做好防范一氧化碳中毒工作的紧急通知凉山州人民政府办公室关于做好防范一氧化碳中毒工作的紧急通知凉府办函〔2021〕2号各县（市）人民政府，州级有关部门（单位）：2021年1月7日，雷波县发生一起疑似室内烧碳取暖一氧化碳中毒，造成5人死亡。州委、州政府领导对此作出批示，要求吸取教训，举一反三，把群众安全取暖宣传教育工作做到位，避免类似事故再发生，确保人民群众安全过冬。为贯彻落实州委、州政府领导批示要求，现就进一步做好防范一氧化碳中毒工作紧急通知如下。一、高度重视，压紧压实责任。各级各有关部门要牢固树立“生命至上、安全第一""的思想，把防范一氧化碳中毒作为当前保障群众安全温暖过冬的重要工作，深刻吸取教训，加强组织领导，对本行业（领域）、本辖区防范一氧化碳中毒工作进行再动员、再部署、再推进，严格落实属地管理责任和部门监管责任，尤其是落实乡镇（街道）、村居（社区）的责任，坚决防范一氧化碳中毒事故发生，确保群众安全温暖过冬。二、全面排查，及时消除隐患。各县（市）要立即组织开展冬季防范一氧化碳中毒专项行动，对燃煤或炭火取暖的住房、出租房、农村住宅的取暖设施和通风情况，以及公共场所、使用煤或炭餐饮店的通风等预防控制措施落实情况进行全面检查。要动员社会各方面力量，发挥基层干部和网格员作用，突出农村、偏远山区等重点地区和孤寡老人、留守儿童、外出返乡人员等重点人群，分片包干，进村入户，排查整治安全隐患。三、广泛宣传，增强防范意识。各级各部门要加强防范一氧化碳中毒常识的宣传普及工作，让群众了解任何煤（碳）种在不充分燃烧的情况下都会产生一氧化碳等有毒有害气体，提高群众清洁取暖安全意识。要充分利用广播、电视、报纸、网站、微信、微博、客户端、公共宣传栏、户外显示屏等媒体，不间断地宣传冬季防中毒安全常识、应急自救知识，剖析事故案例，营造浓厚氛围，让安全宣传教育真正的入耳入心，切实增强人民群众的安全意识和防范能力。凉山州人民政府办公室2021年1月8日"
